{
  "$schema": "https://json-schema.org/draft/2020-12/schema",
  "title": "SessionState",
  "type": "object",
  "additionalProperties": false,
  "required": [
    "schema_version",
    "task_id",
    "route",
    "current_stage",
    "plan_ref",
    "plan_ledger_ref",
    "run_state_ref",
    "latest_checkpoint_ref",
    "next_action",
    "updated_at"
  ],
  "properties": {
    "schema_version": {
      "type": "string",
      "const": "0.2"
    },
    "task_id": {
      "type": "string",
      "minLength": 1
    },
    "route": {
      "type": "string",
      "enum": [
        "small",
        "medium",
        "high"
      ]
    },
    "current_stage": {
      "type": "string",
      "enum": [
        "clarify",
        "plan",
        "execute",
        "spec-review",
        "quality-review",
        "finalize",
        "long-run"
      ]
    },
    "current_task_id": {
      "type": "string"
    },
    "plan_ref": {
      "type": "string",
      "minLength": 1
    },
    "plan_ledger_ref": {
      "type": "string",
      "minLength": 1
    },
    "run_state_ref": {
      "type": "string",
      "minLength": 1
    },
    "latest_checkpoint_ref": {
      "type": "string",
      "minLength": 1
    },
    "latest_review_ref": {
      "type": "string",
      "minLength": 1
    },
    "next_action": {
      "type": "string",
      "minLength": 1
    },
    "updated_at": {
      "type": "string",
      "format": "date-time",
      "pattern": "^[0-9]{4}-[0-9]{2}-[0-9]{2}T[0-9]{2}:[0-9]{2}:[0-9]{2}Z$"
    }
  }
}
